<?xml version="1.0" ?>
<erModel xmlns="ermaket" xmlns:xsi="http://www.w3.org/2001/XMLSchema-instance" xsi:schemaLocation="ermaket er.xsd">
    <entity id="0">
        <name>User</name>
        <attribute>
            <name>Name</name>
            <isPk>true</isPk>
            <type>varchar[256]</type>
        </attribute>
    </entity>
    <entity id="1">
        <name>Task</name>
        <attribute>
            <name>Name</name>
            <type>varchar[256]</type>
        </attribute>
        <attribute>
            <name>Due date</name>
            <type>timestamp</type>
        </attribute>
        <attribute>
            <name>Description</name>
            <type>text</type>
        </attribute>
    </entity>
    <entity id="2">
        <name>Subtask</name>
        <attribute>
            <name>Name</name>
            <isPk>true</isPk>
            <type>varchar[256]</type>
        </attribute>
    </entity>
    <entity id="3">
        <name>Comment</name>
        <attribute>
            <name>Text</name>
            <type>text</type>
        </attribute>
    </entity>
    <entity id="4">
        <name>List</name>
        <attribute>
            <name>Name</name>
            <type>varchar[256]</type>
        </attribute>
    </entity>
    <entity id="5">
        <name>Attachment</name>
        <attribute>
            <name>Contents</name>
            <type>text</type>
        </attribute>
    </entity>
    <entity id="6">
        <name>Item</name>
        <attribute>
            <name>Name</name>
            <type>varchar[256]</type>
        </attribute>
        <attribute>
            <name>Status</name>
            <type>enum('Complete', 'Not complete')</type>
        </attribute>
    </entity>
    <relation>
        <name>is_author_to</name>
        <side>
            <idRef>0</idRef>
            <isMandatory>true</isMandatory>
            <isMultiple>false</isMultiple>
        </side>
        <side>
            <idRef>3</idRef>
            <isMandatory>false</isMandatory>
            <isMultiple>true</isMultiple>
        </side>
    </relation>
    <relation>
        <name>is_assigned_to</name>
        <side>
            <idRef>0</idRef>
            <isMandatory>false</isMandatory>
            <isMultiple>true</isMultiple>
        </side>
        <side>
            <idRef>1</idRef>
            <isMandatory>false</isMandatory>
            <isMultiple>true</isMultiple>
        </side>
    </relation>
    <relation>
        <name>is_written_to</name>
        <side>
            <idRef>3</idRef>
            <isMandatory>false</isMandatory>
            <isMultiple>true</isMultiple>
        </side>
        <side>
            <idRef>1</idRef>
            <isMandatory>true</isMandatory>
            <isMultiple>false</isMultiple>
        </side>
    </relation>
    <relation>
        <name>belongs_to</name>
        <side>
            <idRef>1</idRef>
            <isMandatory>false</isMandatory>
            <isMultiple>true</isMultiple>
        </side>
        <side>
            <idRef>4</idRef>
            <isMandatory>true</isMandatory>
            <isMultiple>false</isMultiple>
        </side>
    </relation>
    <relation>
        <name>is_attached</name>
        <side>
            <idRef>5</idRef>
            <isMandatory>false</isMandatory>
            <isMultiple>true</isMultiple>
        </side>
        <side>
            <idRef>1</idRef>
            <isMandatory>true</isMandatory>
            <isMultiple>false</isMultiple>
        </side>
    </relation>
    <relation>
        <name>contains</name>
        <side>
            <idRef>1</idRef>
            <isMandatory>true</isMandatory>
            <isMultiple>false</isMultiple>
        </side>
        <side>
            <idRef>2</idRef>
            <isMandatory>false</isMandatory>
            <isMultiple>true</isMultiple>
        </side>
    </relation>
    <relation>
        <name>contains</name>
        <side>
            <idRef>2</idRef>
            <isMandatory>true</isMandatory>
            <isMultiple>false</isMultiple>
        </side>
        <side>
            <idRef>6</idRef>
            <isMandatory>false</isMandatory>
            <isMultiple>true</isMultiple>
        </side>
    </relation>
</erModel>